 00:00:00.000000 IP 10.0.2.15.57702 > 168.228.26.204.443: Flags [.], ack 92484517, win 65535, length 0
 00:00:00.000960 IP 168.228.26.204.443 > 10.0.2.15.57702: Flags [.], ack 1, win 65535, length 0
 00:00:14.335726 IP 10.0.2.15.36120 > 185.199.108.133.443: Flags [.], ack 98312646, win 65535, length 0
 00:00:00.000530 IP 185.199.108.133.443 > 10.0.2.15.36120: Flags [.], ack 1, win 65535, length 0
 00:00:01.078003 IP 140.82.113.22.443 > 10.0.2.15.35012: Flags [P.], seq 92614432:92614471, ack 1085694323, win 65535, length 39
 00:00:00.000568 IP 10.0.2.15.35012 > 140.82.113.22.443: Flags [F.], seq 1, ack 39, win 65535, length 0
 00:00:00.000771 IP 140.82.113.22.443 > 10.0.2.15.35012: Flags [.], ack 2, win 65535, length 0
 00:00:00.187097 IP 140.82.113.22.443 > 10.0.2.15.35012: Flags [P.], seq 39:63, ack 2, win 65535, length 24
 00:00:00.000001 IP 140.82.113.22.443 > 10.0.2.15.35012: Flags [F.], seq 63, ack 2, win 65535, length 0
 00:00:00.000022 IP 10.0.2.15.35012 > 140.82.113.22.443: Flags [R], seq 1085694324, win 0, length 0
 00:00:00.000072 IP 10.0.2.15.35012 > 140.82.113.22.443: Flags [R], seq 1085694324, win 0, length 0
 00:00:00.000792 IP 140.82.113.22.443 > 10.0.2.15.35012: Flags [R.], seq 4202352864, ack 2, win 0, length 0
 00:00:03.930480 IP 10.0.2.15.36021 > 177.124.186.254.53: 10249+ [1au] AAAA? connectivity-check.ubuntu.com. (58)
 00:00:00.655991 IP 177.124.186.254.53 > 10.0.2.15.36021: 10249 12/0/1 AAAA 2001:67c:1562::23, AAAA 2620:2d:4000:1::98, AAAA 2620:2d:4002:1::196, AAAA 2620:2d:4002:1::197, AAAA 2620:2d:4000:1::23, AAAA 2001:67c:1562::24, AAAA 2620:2d:4000:1::97, AAAA 2620:2d:4000:1::22, AAAA 2620:2d:4000:1::2b, AAAA 2620:2d:4000:1::2a, AAAA 2620:2d:4002:1::198, AAAA 2620:2d:4000:1::96 (394)
 00:00:10.529556 IP 10.0.2.15.34422 > 172.217.30.110.443: Flags [.], ack 92360815, win 65535, length 0
 00:00:00.000673 IP 172.217.30.110.443 > 10.0.2.15.34422: Flags [.], ack 1, win 65535, length 0
 00:00:16.383200 IP 10.0.2.15.57702 > 168.228.26.204.443: Flags [.], ack 1, win 65535, length 0
 00:00:00.000538 IP 168.228.26.204.443 > 10.0.2.15.57702: Flags [.], ack 1, win 65535, length 0

